<?xml version ="1.0" encoding="UTF-8"?>
<!-- The Document Type Definition (DTD) for the file -->

<!ELEMENT FIELDDEF (DEF)*>
<!ELEMENT DEF (#PCDATA)>
<!ATTLIST DEF
LENGTH CDATA "1" 
TYPE (UInt8|SInt8|UInt16|SInt16|UInt32|SInt32|UInt64|SInt64|Bool|Binary|String|Float|Double) #REQUIRED 
>
